{
  "schema_version": "1.0",
  "created_at": "2026-08-15T12:00:00Z",
  "environment": "synthetic-test",
  "request_summary": "Create a synthetic internal executive report handoff package.",
  "classification": "internal",
  "locale": "en-GB",
  "destination": {
    "kind": "onedrive",
    "logical_location": "synthetic-pilot-intake"
  },
  "trusted_instructions": {
    "operation": "create",
    "require_human_approval_before_replace": true,
    "allow_external_publication": false,
    "allow_macros": false
  },
  "artifacts": [
    {
      "artifact_id": "executive-report",
      "kind": "word",
      "payload": "inputs/executive-report.word.json",
      "output_filename": "Executive Report.docx",
      "template_profile_id": "solosentry-word-handoff-pilot",
      "template_version": "1.0.0",
      "template_sha256": "1111111111111111111111111111111111111111111111111111111111111111"
    }
  ],
  "source_register": "inputs/source-register.json"
}
